id,question,author,answer,date,answer_relevance
117,"On a point of order, Mr. Speaker. Question No. 93, which is in my name and is a similar Question to this, was transferred to the Lord Privy Seal. Could it not be answered as well? Is the right hon. Gentleman aware that President Reuther was convinced that the first step towards showing everybody's good faith was to have free elections in every sector of Berlin, and could that be kept in mind as a suggestion when the Powers meet? Is the right hon. Gentleman aware that President Reuther was convinced that the first step towards showing everybody's good faith was to have free elections in every sector of Berlin, and could that be kept in mind as a suggestion when the Powers meet?","Sir J. Lucas","Of course, that is the proposal we made as long ago as the very first discussion we had four or five years ago. It would be very agreeable if it could take place.",1961-08-01,0.20316166
234,"Would it be a fair statement of the Government's position to say that consultation with the Commonwealth has been equally close or equally distant in respect of Common Market negotiations and the Commonwealth Immigrants Bill, and vice versa?","Mr. M. Foot","No, Sir. In reference to these negotiations, I see that the Prime Minister of Australia, and now the Prime Minister of Canada, have recognised in public speeches that we have tried, over the long period that this matter has been under discussion, to keep the fullest consultation and information with our Commonwealth friends.",1961-11-16,0.2800667
351,"As public expenditure is a matter of very great concern to the House, and as the Chief Secretary is a member of the Cabinet and the Financial Secretary is not, should not hon. Members on both sides have the chance to ask Questions of the Chief Secretary who, otherwise, will not appear at Question Time at all?","Mr. Jay","I think that this will work itself out in the most convenient way if Questions are put to the Chancellor of the Exchequer. It just so happens that there has not been a Thursday recently on which the Treasury Questions have been reached.",1961-12-05,0.15021236
468,"Would the Prime Minister answer two questions arising out of the communiqué issued after the talks? Firstly, can he say whether the discussions about the possible resumption of nuclear tests were concerned with joint testing by the United States and the United Kingdom, or with testing by the United States alone? Secondly, can he say whether, in fact, a request was made by the United States Government for facilities on Christmas Island?","Mr. Gaitskell","I should not like to go further than the communiqué at the present time. At the earliest possible moment I will make a further statement.",1962-01-23,0.06474928
585,"Will the Prime Minister bear in mind that Mr. Khrushchev made it plain in his letter that he was not proposing another Summit Conference, but simply that the Heads of State would be associated with these vitally important negotiations? Is not this fundamentally very much the same idea as President Kennedy and the Prime Minister himself proposed in their letter to Mr. Khrushchev?","Mr. Gaitskell","There are, of course, similarities; but we do feel that, although a formal meeting of eighteen Prime Ministers—to make, no doubt, eighteen speeches, which would take quite a time—may be valuable, what is important in our proposal is the practical meeting of the three nuclear Powers, which have rather special responsibilities. Our problem is how to try to make a workable plan which will get the best of both, and we are considering our reply.",1962-02-13,0.17147449
702,"In retrospect, can the Prime Minister recall that not long ago this House passed the Overseas Service Act which made generous provision for a great many overseas civil servants? I think I am right in saying that that will cost this country about£160 millions over ten years. Therefore, a great deal has been done about which we may be proud.","Sir H. Oakshott","Yes, Sir. It would be a great mistake if it were to go outside this House that the Houses of Parliament have not been willing to accept very heavy responsibilities.",1962-03-01,0.16630189
819,"asked the Prime Minister whether, in view of public interest throughout Wales in a revision of the leasehold laws he will state the terms of his reply to the letter he has received from the Methodist Church in South Wales on the subject of leasehold reform.","Mr. G. Thomas","The letter to which the hon. Member refers was acknowledged on my behalf. I have noted the views expressed in it and passed them on to my right hon. Friend  the Minister of Housing and Local Government who has the matter under consideration.",1962-03-27,0.081659436
936,"asked the Prime Minister whether the speech of the Lord Privy Seal to the Ministerial Meeting of Western European Union on 10th April represents the policy of Her Majesty's Government.","Mr. H. Wilson","Yes, Sir.",1962-04-19,-0.002397313
1053,"I express my appreciation of the right hon. Gentleman's courtesy in answering my Question. I never thought that his refusal to answer was prompted by anything but a desire to serve the convenience of the House. Does he realise that very few people in this country, if any, wish to be stampeded into an unnecessary or perilous war, in the way that we were stampeded by our allies in the case of Korea? In the South East Asia Treaty Organisation is not it a prerequisite to action, first, that there should be a request for assistance by the country concerned, and, secondly, that there should be prior consultation among the parties to the Treaty? Is it not the case that the Americans have landed troops in a country, in purported pursuance of their duties or rights under the Treaty, when neither of these prerequisite conditions had in fact occurred?","Mr. Silverman","If the hon. Member is referring to the landing of troops in Thailand, that is an entirely different matter, and it is one about which I hope to be able to speak to the House in a few moments' time.",1962-05-17,NULL
1170,"asked the Prime Minister what agreement he reached with President de Gaulle on the subject of Great Britain's willingness to renounce Commonwealth preferences and acquiesce in the formation of a French nuclear striking force as part of the price for entering the Common Market.","Mr. Zilliacus","I would refer the hon. Members to the Answer which I gave to the hon. Member for Glasgow, Govan (Mr. Rankin) on 5th June.",1962-06-07,NULL
1287,"Does not this proposal about detection offer by far the best opportunity of reaching a solution, or at any rate a partial solution, of this very vexed problem? Can the right hon. Gentleman say whether the reports which appeared in several newspapers this morning that conversations to this effect, albeit of an informal character, have already taken place in Geneva, and will he encourage the British delegate there—I understand that it is the Secretary of State for Foreign Affairs—to express, so far as is practicable, a conciliatory opinion?","Mr. Shinwell","I think that what we all hope to get is a successful negotiation. I hope the House will feel that we have tried to negotiate in the way most likely to get results. I am not able to say today how far the possibility of not having to have the inspection system on Russian soil alters the question whether certain on-site inspections will still be required as part of any treaty. All this is being carefully examined, and we hope to make progress.",1962-07-17,NULL
1404,"In view of President Kennedy's statement yesterday that the Americans are to carry out three more high altitude tests and in view of Mr. Khrushchev's announcement of the intention of his Government to carry out high altitude tests, may I ask the Prime Minister whether any further proposals have been agreed between him and President Kennedy with a view to expediting the achievement of a nuclear test ban treaty and so end the need for these tests?","Mr. Henderson","We have very close communication on this subject which, as the right hon. and learned Gentleman knows, is now being discussed at Geneva. I hope that we may be able to make some valuable proposals.",1962-08-02,NULL
1521,"Is not part of the difficulty caused by the fact that the two Departments are not combined, which necessarily means an exceptionally heavy burden on the Secretary of State? Will the Prime Minister consider whether the time has not come—since he seems unlikely to separate the two again—when they should be properly integrated so that the civil servants can share the burden?","Mr. Gaitskell","Yes, Sir. I think that steps to closer co-operation are being taken and we may at some point be able to take a further step. This seems the best way to start the experiment.",1962-11-22,NULL
1638,"Would not the Prime Minister put an end to the doubts and misgivings which obviously exist by stating quite clearly that the Government are opposed to the creation of a European, N.A.T.O. or Common Market nuclear force and stand with the United States in demanding unified control of any such force?","Mr. Zilliacus","I am glad to see that on this matter the hon. Member ranges himself beside General de Gaulle.",1962-12-13,NULL
1755,"Can the Prime Minister give any indication how far Her Majesty's Government have gone in their policy to facilitate talks on Kashmir and the differences between India and Pakistan?","Mr. Donnelly","As the hon. Member probably knows, these talks are continuing, and we must hope for their success.",1963-02-05,NULL
1872,"Is the right hon. Gentleman aware that there is at present considerable competition on his own side on the need for finding an immediate successor to him? Will he provide facilities for that?","Mr. Shinwell","No, Sir. The difficulty about the whole problem raised in these questions is that there appears to be equal anxiety on the part of some people to go to the House of Lords and on the part of others to come back to the House of Commons. But we must find a way through.",1963-02-21,NULL
1989,"Would my right hon. Friend use any influence which he may have with the Leader of the Opposition and ask him to persuade the four Socialist-controlled councils in the immediate vicinity of Cardiff which have consistently refused to sell freeholds to sitting leasehold occupiers⤔","Mr. Box","I will do what I can through the usual channels.",1963-03-12,NULL
2106,"Did the Prime Minister say just now, or did we mishear him, "if the remarks of the Lord Privy Seal are of any value"? Is not that a rather ominous remark?","Mr. Driberg","I said, "if they were of any value" in relation to the Question. That is what I meant. I have read this report as closely as I can but I cannot find this point. I will look at the report again. It is very long.",1963-04-02,NULL
2223,"asked the Prime Minister if he is aware that the late Mr. H. V. Pennells was wrongly blamed in Command Paper No. 2009; and whether he will cause further inquiries to be made especially from those who knew him.","Commander Kerans","I have no evidence for thinking that the Tribunal was mistaken in its conclusions about the late Mr. Pennells; but it is important to see these conclusions in proper perspective. The Tribunal considered that Mr. Penells was remiss and lacking in judgment in not taking effective action, notwithstanding warnings from the Foreign Office, to seek a review of the system of selecting subordinate staff for naval attachés behind the Iron Curtain. But it said that it would be unjust to conclude that Mr. Pennells had been negligent of his public duty, and it commented that in general he was efficient and conscientious and served the Admiralty well.",1963-05-02,NULL
2340,"In view of the very startling statement made in this report of British scientists, have the Government specifically asked the American Government for an assurance that they would not embark on such tests without consultations with us?","Mr. M. Foot","No, Sir. I should not try, and I should not lend myself to trying, to prevent something if it is really of great national security importance.",1963-05-28,NULL
2457,"asked the Prime Minister if he will arrange, that when complex legislation is presented to the House, particularly a Finance Bill, a detailed explanatory memorandum is published in the form of a White Paper.","Mr. O'Malley",":There would be great practical difficulties in producing a detailed memorandum explaining all the proposals covered by a typical Finance Bill to coincide with the publication of the Bill. On the other hand, on the occasion of the Finance Bill, 1962, a White Paper was issued explaining the provisions relating to short-term gains and my right hon. Friend the Chancellor of the Exchequer will continue to bear in mind the possibility of publishing, at a reasonable interval after the publication of the Bill itself, a memorandum about unusually complicated sections of the Bill.",1963-07-04,NULL
2574,"asked the Prime Minister whether he will take steps to enable the House in future to discuss the reports of the Ecclesiastical Committee on Measures presented by the Church Assembly for its consideration, so that hon. Members may have the opportunity of expressing their opinions before being presented with a completed Measure which they have the option of approving or rejecting but not of amending.","Mr. John Page","No, Sir. I do not think it would be right for the Government to take an initiative of this kind.",1963-07-25,NULL
2691,"Can the right hon. Gentleman explain in what capacity the Lord Chancellor appeared on the platform at the Tory Party conference in October? Will he say in what capacity the noble Lord addressed the German judges a few months ago, a speech in which he made a violent attack on the Leader of the Opposition in this House? Does the right hon. Gentleman agree that this is the way to teach German judges the impartiality of the judiciary? I am asking a question of the Prime Minister, Sir, and I should very much like an answer to it.","Mr. Hamilton",rose—,1963-11-21,NULL
2808,"Is the Prime Minister aware that, with due respect to my right hon. Friend the Leader of the Opposition, the usual channels on my side are somewhat conservative? Would he consider on occasion establishing a new channel?","Mr. Donnelly","I do not think I can give the hon. Member much hope, because a lot more people will be going Conservative in future.",1963-12-12,NULL
2925,"Surely my right hon. Friend will agree that democracy requires that there should be the fullest expression in the newspapers of every point of view? Since this cannot be done unless we have a widely diverse type of Press, ought not this to be looked at again?","Sir C. Osborne","It is very difficult. This is a genuine difficulty, as I think the whole House would find. We might be able to stop the acquisition of one newspaper by another, through, let us say, an amalgamations court. But how? If an amalgamation is stopped, we cannot say that the newspaper we wish to save will continue to exist. That is the difficulty.",1964-01-21,NULL
3042,"Are we to understand that the promise given in Standing Committee by the Minister of Defence to my right hon. Friend the Member for Easington (Mr. Shinwell), that three Ministers of Defence for the individual Services would be appointed, will be included in the Order in Council?","Mr. Bellenger","I should not like to say what will be included in the Order in Council. I gather that, whatever is put into an Order in Council or whatever is in present legislation, technically these Ministers will be Ministers of State, but they can be given any title and be paid salaries appropriate to their status.",1964-02-06,NULL
3159,"In giving full support to American policy in South Viet-Nam, did the Prime Minister receive any return assurances from President Johnson that the American Government intended to bring their war in Viet-Nam to an end and to seek a policy based on the Geneva Agreements of 1954?","Mr. Warbey","The whole purpose of this help to the South Viet-Nam Government is to bring these operations to an end, but there is a continuous infiltration of Communists from the north.",1964-03-03,NULL
3276,"Is not the Prime Minister aware that in the week before the Easter Recess we had Answers from the Minister of Health, the Under-Secretary of State for Scotland and the Leader of the House on the question of the World Health Centre which were completely contradictory? In those circumstances does he think that there is something to be said for co-ordinating arrangements in this case? Would he care to take the opportunity to state categorically whether, with the proviso which he has just mentioned, the Government support this idea?","Mr. K. Robinson","We have asked the Director-General of the World Health Organisation to give further consideration of this matter of the international laboratory because as a result of the international discussions the great majority of countries including our own, have not felt that it is desirable at present.",1964-04-07,NULL
3393,"As the Secretary of State for Scotland has committed the Government to a plan to abolish slums in Scotland, will the Prime Minister tell us what time it will take to wipe out the slums that now exist in Glasgow?","Mr. Rankin","The Secretary of State gave the best indication that he could when he said that we aim to do it in 10 years, but it may take longer, of course.",1964-04-23,NULL
3510,"Is not there a strong case for putting on historical record all the facts, not only with regard to the military operations which took place, but also with regard to the political events which led up to the opening of the campaign? Is not this essential in view of the doubts and suspicions which undoubtedly exist on this question?","Mr. A. Henderson","I think that I have answered the right hon. Gentleman's question. I do not think that there is a case for an inquiry.",1964-05-14,NULL
3627,"Will my right hon. Friend agree that the R.A.F., which is there to support B.A.O.R., is equipped with nuclear weapons of British manufacture?","Mr. Hastings","Yes, Sir. The bomber deterrent force has British warheads.",1964-06-25,NULL
3744,"Is the right hon. Gentleman aware that we shall all be gratified to know that in the days of Lord Attlee's Administration not only the country but the House was three times as satisfied with its Prime Minister as it is today? Are we now to take it that the figures given by the right hon. Gentleman will be a real sign of the ineffectiveness of the Conservative Opposition after October?","Mr. H. Wilson","I think the right hon. Gentleman had better wait and see, but I seem to remember that Lord Attlee was defeated.",1964-07-16,NULL
3861,"Does my right hon. Friend recognise the importance of increasing the power and effectiveness of the control of the Legislature over the Executive? As in recent weeks he has rightly strengthened the power and the effectiveness of the Executive, to the extent that he does not do something similar for the Legislature he is increasing the gulf between the two. Does he regard that as wholly desirable?","Mr. Hamilton","As a former Chairman of the Public Accounts Committee, I can say that my hon. Friend is preaching to the converted on this matter. The whole House will be aware of the tremendously increased impact of the Select Committee on Estimates in the last two or three years and of the very valuable work done in that Committee by the appointment of members of the Clerks' staff to work on that Committee. However, this is still an open question and I would have thought that the right place to consider it would be the Select Committee on Procedure.",1964-11-12,NULL
3978,"Can the Prime Minister say what security screening is given to these outside advisers and whether they are allowed to see any classified documents without being screened? Will he advise the advisers that the contradictory briefings given last weekend about the strength of B.A.O.R. are not helpful to anyone?","Mr. Goodhart","Exactly the same security considerations apply here as applied with the previous Government. There has been no change whatsoever in this respect. But I would make this point, because this is a problem which faced the previous Government as well as the present one. There are difficulties about the question of information officers in all Departments, and I think that there is a general desire, which I believe was shared by the previous Government, that we must try to do something towards working out a better form of career service in this field. Of course, it will be essential all the time to keep on recruiting those with journalistic experience, and this is highly desirable. But it would be a good thing if we were able—this is what we are trying to do—to work out a system of recruiting young journalists with short journalistic experience and bring them into a career service and, on occasion, as all Governments have done, to recruit them on a short—service commission basis.",1964-12-03,NULL
4095,"When this meeting is held, will my right hon. Friend consider making proposals for a reduction in military expenditure in view of the crippling effect that this is having on our economy?","Mr. Evans","I think that one of the most important questions which the whole House has agreed should be discussed at the earliest opportunity, both with our allies in N.A.T.O. and of course in any East-West discussion, is the prevention of the proliferation of nuclear weapons. I imagine that this would be a very important subject for discussion and I would feel also that the question, over a period of time, of a reduction of forces and weapons on both sides of the Iron Curtain is something which is of mutual interest to both East and West.",1965-02-02,NULL
4212,"asked the Prime Minister whether he will give an assurance to the Government of India that in the event of that country being invaded by armed forces the British Government will give both military and economic aid independent of the action of the United Nations.","Viscount Lambton","I would refer the hon. Gentleman to my answer to the Question put by the hon. Member for Bury St. Edmunds (Mr. Eldon Griffiths) on 4th February. Any action we should take in such circumstances would be in accordance with the principles of the United Nations Charter and would, we hope, be supported by the Organisation.",1965-02-23,NULL
4329,"Would the Prime Minister answer a simple and non-controversial question on this matter? I know that he is aware that, rightly or wrongly, there has been criticism of the amount of consultation which has taken place. That criticism has come from the House of Commons and from both sides of the steel industry. Is the right hon. Gentleman satisfied that the amount of consultation which has taken place is adequate?","Mr. Iain Macleod","Yes, Sir. My right hon. Friend is perfectly willing to meet anyone who wishes to be consulted on this question. He has been willing throughout, and if there has not been more consultation it is because it has not been asked for.",1965-03-16,NULL
4446,"Does the Prime Minister still believe that the proportion of our trade with the Commonwealth could be greatly increased or does not he now think it likely that, over a long period, it will continue to decline, as was persuasively argued in his pamphlet, "Why Britain should enter the Common Market", written a couple of years ago by the Secretary of State for Commonwealth Relations?","Mr. Chataway","I am glad the hon. Gentleman is widening his reading. I should be very sorry to feel that he was really as defeatist about increasing Commonwealth Trade as he suggests. For some years now, there has been a decline, and it is regrettable that the decline accelerated in the past four or five years. I am not underestimating the difficulties of reversing the decline. I wish that somebody had started on it  a bit earlier; that is all. We shall certainly do what we can to halt the decline and reverse the trend, and I should not like to begin approaching the problem with the pessimism of the hon. Gentleman.",1965-04-01,NULL
4563,"Can the right hon. Gentleman tell us what is the precise rôle of the Paymaster-General in this particular matter?","Mr. Stainton","I may even have something to say on that subject when I am free to make a statement on security. I am sure that the hon. Gentleman will realise that this Government, on coming into office, decided to set on foot all the arrangements necessary so that we should never again have a situation of a Prime Minister saying that he had never been told about security matters that had been common knowledge for three months.",1965-05-06,NULL
4680,"How can we operate air power east of Suez without the strongest reconnaissance aircraft with a range of 1,500 miles? If this is not to be another example of the Prime Minister's double standards, surely we have no alternative but to buy the F.111 with our scarce money resources?","Mr. Ridsdale","The double standards arise in the pretence that we have got the TSR2 or that it would be available in the time required. As my right hon. Friend and I have made clear many times, we are going through a very intensive review of our rôles in different possible theatres in relation to the cost, something which apparently our predecessors never did.  This is clear in view of the escalation of defence costs in the last year or two. As soon as this is clear, I hope that we shall be able to report to the House about our conclusions. The answer I gave to the first question represents the position of the Government as at present until the review is completed.",1965-05-25,NULL
