id,question,author,answer,date,answer_relevance
45864,"Yesterday, the hon. Members for Newark (Patrick Mercer) and for Portsmouth, South (Mr. Hancock) and I hosted the parliamentary launch of the “honour the brave” campaign, along with Pearl Thrumble and Helen Gray, two mothers who have lost sons in Afghanistan. The aim of the campaign is to secure a medal for men and women who die or are injured in combat, so may I urge my right hon. Friend to use his good offices to try to ensure that the medal is awarded to those brave men and women, whose courageous families are also supporting their efforts to secure peace in Afghanistan and Iraq?","Mr. Kevan Jones","I join my hon. Friend in passing my condolences to the brave relatives of Private John Thrumble and Private Chris Gray who were both killed in Afghanistan in 2007. The whole House will honour all those who have given their lives in Afghanistan and those in Iraq who have laid down their lives for their country. On the question of whether a new medal is struck for those who have been killed or injured, it is first a matter for the military authorities to make a recommendation. The matter is being looked at with intensity in the Ministry of Defence. We look forward to hearing the recommendations that are made, and we will of course support them. I believe that the whole country wishes to honour people who have given their lives or who have been injured in the service of our country.",2007-11-14,NULL
45981,"Q4.  Drug use and antisocial behaviour fell in my constituency with the development of Kenfig Pyle Community Youth, which offers young people opportunities to engage in arts, sports and other activities. Will my right hon. Friend agree to meet a delegation from KPCY to discuss how young people can engage further in cutting antisocial behaviour, drug use and drinking? (173038)","Mrs. Madeleine Moon","My hon. Friend is absolutely right. We have to be tough on antisocial behaviour and abusive drinking among young people, and at the same time, we must say to young people that if they want to get off the streets, we will provide youth facilities for them. Yesterday’s children’s plan was historic, because it was the first announcement of youth centres for every constituency in this country, with £160 million to be spent over the next three years. That is honouring our commitments to the teenagers of this country, in the same way as we have honoured our commitments to young children with Sure Start centres. I hope that there will be all-party support for this new investment.",2007-12-12,NULL
46098,"Before Christmas, the Justice Secretary said that his Department would be building three so-called titan prisons. This morning, he said that those prisons “may” now be built. Will the Prime Minister tell the House whether this is a titanic failure or a titanic U-turn?","Mr. Shailesh Vara","We will go ahead with these prisons following the consultation that my right hon. Friend said would take place.",2008-01-30,NULL
46215,"Q7.  I know that my right hon. Friend wants to engage and involve young people in their communities as volunteers and in the democratic process. Does he agree that lowering the voting age to 16 would help to bring that about? (191543)","Julie Morgan","In the White Paper on the constitution, the Government said that we would consider lowering the voting age to 16 and that is now part of the debate that will take place in the country. On Friday, we announced the appointment of Jonathan Tonge as chair of the Youth Citizenship Commission, which will consider a range of issues including not only the voting age, but the curriculum on citizenship and whether there is a case for a citizenship ceremony when people come of age. All those issues should be part of a public debate.",2008-03-05,NULL
46332,"The Westmorland general hospital is the major provider—or rather the provider—of acute coronary and other medical services to an area larger than Greater London, but those services are proposed for closure later this year. If we believe our local ambulance service—as of course we must—that would leave 63 per cent. of my constituents taking more than the golden hour to get to hospital in the event of a stroke or a heart attack. Will the Prime Minister take a personal interest in the matter and agree to meet me and local health professionals in South Lakeland to help to resolve it?","Tim Farron","Obviously I shall look at what the hon. Gentleman says and the facts he brings before me, but he needs to put the matter in its proper perspective. We have doubled expenditure on the national health service, there are 30,000 more doctors and 80,000 more nurses, and 110 hospitals have either been built anew or are being refurbished. Of course I will look at what the hon. Gentleman says, but he should put it in its proper perspective: there is more investment than ever before in the health service in his area.",2008-04-23,NULL
46449,"That is absolutely no answer to the question of how on earth it is green to tax someone who bought a car five years ago. The director of Greenpeace says:“It’s the kind of measure that gives green taxes a bad name because it does not change behaviour.”A bit closer to home, we have a Government Parliamentary Private Secretary, the hon. Member for Wolverhampton, South-West (Rob Marris), who asks, quite rightly“how can you change behaviour when you are introducing a tax on an action that took place seven years earlier? ...millions…could be affected”.The hon. Gentleman said that this is “retrospective taxation” and that it is “undesirable”. If this is the Government policy that the Prime Minister is so proud of, what is that man still doing in the Government?","Mr. Cameron","We have put forward our proposals on VED. The Conservatives put forward a document suggesting even more extreme and radical proposals than this. The right hon. Gentleman is backing away from his proposals as he has done on just about everything else. I believe that we have to deal with the problems of pollution. He said that he would, but he refuses to do so.",2008-06-04,NULL
46566,"A group of my constituents will be visiting the House today with a petition opposing a proposal associated with the expansion of Heathrow to drive a road through our cemetery, where many of our loved ones are buried. Does the Prime Minister appreciate that the Government now remain, apart from the most rapacious sections of the aviation industry, virtually isolated in their support for expansion of Heathrow? Can I ask him to think again and reassess the environmental, social and economic consequences of a third runway at Heathrow? This will not be interpreted as running away; this will be interpreted as being on the side of our community.","John McDonnell","It is right to listen to communities when these big decisions are made, and it is right to take into account what local people are saying on these matters. But this is also a big strategic decision for the country and we cannot afford to duck a decision about the future of airports for many years ahead. That is why it is right in principle to go ahead with airport expansion.",2008-07-16,NULL
46683,"The Prime Minister will be painfully aware that since the 1930s, no Labour Government have left office with unemployment lower than when they entered office, and usually after a recession. Will his Labour Government be any different?","Richard Ottaway","We have created 3 million jobs in the last 10 years, and even with the rise in unemployment, it is lower than having 3 million unemployed under the Conservatives. We never said that unemployment was a price worth paying; it was the Conservatives.",2008-11-12,NULL
46800,"The value of Railtrack was talked down by the previous Deputy Prime Minister so that the company could in effect be renationalised. Is that what the Prime Minister and the Chancellor are doing to our banks?","Mrs. Jacqui Lait",No.,2009-01-21,NULL
46917,"What the Prime Minister just said about the hospital in Stafford simply is not enough. We do need a review of the case notes, but we do not just want a Care Quality Commission review. What we need is a full public inquiry to get to the bottom of the matter. It is not enough simply to deal with the issue in the way he described. We need to know whether compensation will be payable to the victims, and we need to ensure that the people responsible who are still on the board are sacked, and not simply suspended on pay.","Mr. William Cash","I know that the hon. Gentleman’s constituency is covered by the hospital as well, so let me reply to him in some detail. All disciplinary matters are being dealt with at the moment by the new chief executive, who is looking at what has happened in the hospital over these last few years in the light of the Healthcare Commission report. A Healthcare Commission report will be followed up by a review into what happened between 2003 and 2006, and an inquiry by George Alberti about whether the standards that have been raised are actually satisfactory for people in the area. At the same time, the Care Quality Commission will look at the standards of health care overall, and look at whether there is an early warning system that could be better in future for dealing with such problems. Individuals, of course, can bring what cases they wish, but I think that they will welcome the fact that the individual case notes are to be made available to them, and are to be reviewed independently.",2009-03-18,NULL
47034,"Q5.  In the last 18 months, Erewash credit union has saved local people £170,000 that would otherwise have gone to doorstep lenders in high interest rates. That reduces the misery experienced by people trapped in debt and releases extra money into the local economy. As my right hon. Friend knows, the Department for Work and Pensions growth fund backs credit unions. Will he assure me that that fund will remain the highest Government priority? (274647)","Liz Blackman","In the Budget we added an extra £18.5 million to help the credit funds. More than 100 credit unions have already benefited from that fund, and more than 150,000 people are being helped. I know that the credit union in my hon. Friend’s constituency is a shining example of what is possible, with 700 people obtaining affordable credit. It is making new investment to help people with housing, which is desperately needed in her area. I congratulate her credit union on doing a fantastic job. We want to support credit unions in every part of the country, with both more support and more legislative backing in future.",2009-05-13,NULL
47151,"In May 1997, there were 1,826 people unemployed in Wellingborough; at the end of last month, that figure had risen to 3,366—an increase of 84 per cent. Whose fault is that: is it (a) the last Conservative Government; (b) the previous US President; or (c) the Prime Minister who claimed he had ended boom and bust?","Mr. Peter Bone","The figures are all the more reason to support our policies to get people back to work. Were it not for the policies we are adopting, 500,000 more people would be out of work—that is what official estimates say. The hon. Gentleman should be supporting the public expenditure we are engaged in to help people get back into work.",2009-06-24,NULL
47268,"First, may I join the Prime Minister in expressing my condolences to the families and friends of the people he mentioned?Will the Prime Minister ensure that any announcement by the Justice Secretary on pleural plaques will ensure a commitment to compensating pleural plaques victims from the past, the present and the future?","Mr. Hepburn","I know the anxieties that people who are diagnosed with pleural plaques have. I know also that there have been a huge amount of medical inquiries into this big issue. I know too that those who end up suffering from asbestosis suffer from one of the worst and most painful diseases imaginable, and it is right that we have the proper compensation in place for them. I am looking forward to meeting my hon. Friend and a group of MPs tomorrow to discuss this very issue with the Justice Secretary. It is important, after the legislation that has come before the House, that we get a resolution soon.",2009-10-28,NULL
47385,"Given the £100 million raid on Welsh lottery funds and the non-Barnettising of the cost of the Olympics, what can the people of Wales realistically expect for the £427 million that they are paying for the London Olympics?","Mr. Elfyn Llwyd","Let me first congratulate the new leader of the Welsh Labour party and the prospective First Minister of Wales, Carwyn Jones. I believe that he will be an excellent leader.Over the past 12 years, expenditure on Wales has grown markedly as a result of the decisions of a Labour Government. The hon. Gentleman should be grateful that there is additional expenditure on health, education, sports and culture in Wales. We will continue to honour our commitments to the people of Wales.",2009-12-02,NULL
47502,"Look at what we have: we have troops in battle without proper equipment and guillotined defence budgets in a world that has changed out of all recognition since the cold war, yet the Prime Minister and the Leader of the Opposition want to spend billions of pounds of taxpayers’ money replacing and renewing a nuclear missile system designed to flatten Moscow at the touch of a button. How are we to face the threats the country faces if Government thinking is so stuck in the past?","Mr. Clegg","I give the right hon. Gentleman credit for being consistent in his policies—something that I cannot say about the Opposition. It is important for us to maintain the resources we are spending in Afghanistan and it is important to understand in our strategic defence review that we are dealing with the problem of global terrorism, which is quite different from what we have experienced before. I assure the right hon. Gentleman that we will look carefully at all the uses of equipment for the future. It is important to recognise that we want to be part of multilateral discussions for the future.I add that it is not fair to our troops in Afghanistan to give the impression that they are not properly equipped for the job they are doing. We have spent £3.5 billion from the reserve this year and it will be even more next year. The average expenditure per member of our forces is nearly £0.5 million to ensure that they are properly equipped. More helicopters have gone into Afghanistan over the last few months, as have more vehicles. Special attention is being given to counter-terrorism and dealing with the threat of improvised explosive devices. It is completely wrong to say that our troops are not properly equipped. We are proud of them; they are professional; and they are properly equipped for the job they are doing.",2010-02-03,NULL
47619,"Q15.  Under Labour, interest rates over the past year have been just 0.5 per cent. In the previous, Tory recession, they were 15 per cent. What impact would a thirtyfold increase in interest rates have on hard-working families paying mortgages, and on defence companies, such as Kent Periscopes in my constituency, which are looking to grow? (322432)","Chris Ruane","My hon. Friend is absolutely right. Unemployment is half what it was in the 1990s, when interest rates meant that mortgage repossessions were about three times what they are now; and there are more small businesses now than there were a year ago, whereas in the 1990s small businesses faced 15 per cent. interest rates and went under. The Conservatives say they are the party of change, but the only economic policy that they have is to go back to the 1980s.",2010-03-17,NULL
47736,"I can answer the Prime Minister’s question, although, to be fair, he is supposed to be answering mine. Yes, I do support the OBR, but he will not say whether he welcomes the forecast that I set out earlier. It is clear what he is doing: he is talking down the economy and the public finances in order to soften up the public for the cuts that he wants to make. Does he not realise that, in doing that, he is also undermining business confidence? How can that be right?","Ms Harman","What the right hon. and learned Lady and other Labour Members need to remember is this: never mind talking the economy down, they did the economy down. They left this country with a £155 billion deficit—the biggest deficit in our peacetime history. They are the ones who let the banks go rip. They told us that they had abolished boom and bust, yet they gave us the biggest boom and the biggest bust. They were the ones who told us we were going to lead the world out of recession; our recession was longer and deeper than others. They have not told us about one single penny of the £50 billion that they were going to cut—not one penny. Do you know where they ought to start? Why not start with an apology?",2010-06-16,NULL
47853,"Will the Prime Minister consider having another conference call with Mark Zuckerberg, co-founder of Facebook, whose site is currently hosting the group “RIP Raoul Moat”,  where a whole host of anti-police statements are posted? Can the Prime Minister have a conversation with Mark Zuckerberg about removing this group?","Chris Heaton-Harris","My hon. Friend makes a very good point. As far as I can see, it is absolutely clear that Raoul Moat was a callous murderer—full stop, end of story—and I cannot understand any wave, however small, of public sympathy for this man. There should be sympathy for his victims, and for the havoc he wreaked in that community; there should be no sympathy for him.",2010-07-14,NULL
47970,"Q5.   Last year, the Prime Minister saw how High Peak borough council, through a pioneering alliance with Staffordshire Moorlands, had delivered efficiency savings of almost £2.4 million over the past two years. Will he assure the House that he will strive to support councils such as High Peak, which have sought to deliver better value for money and ensure that local people benefit as a result? (19523)","Andrew Bingham","My hon. Friend makes an extremely good point. My council does exactly the same thing: it shares a chief executive, and soon more of the management team, with a neighbouring council. All councils can look at that. Frankly, it is not just councils—police forces and other organisations can look at shared services to drive down costs, so that we make sure we focus on the front line. Those are some of the reforms we need, to make sure that at a time of tight budgets we keep the good services we want.",2010-10-27,NULL
48087,"Mr. Speaker, have you ever heard a more complacent answer to a question? Families up and down the country are worried about their jobs and  unemployment will rise next year, and all the Prime Minister can say is that it is some kind of rosy scenario. Let us take the rise in VAT, because that is one of the reasons why unemployment will rise next year. Can the Prime Minister tell us what impact that will have on economic growth and jobs next year?","Edward Miliband","First of all, let me deal with VAT precisely. The former Chancellor, the right hon. Member for Edinburgh South West (Mr Darling) said:“VAT would have allowed you to pay off a sizeable chunk of the deficit.”That is the policy that the last Chancellor supported.If we had followed over the last six months the advice of the Leader of the Opposition, we would be linked with Portugal, with Ireland— Yes. We would not be standing here today discussing how we will get faster growth and lower unemployment; we would be sitting around discussing how to rescue and bail out Britain.",2010-12-01,NULL
48204,"Q13.   The right to strike is an important one and the hallmark of a free society, but with rights come responsibilities. Does the Prime Minister agree that any union ballot that leads to industrial action should have the majority support of those entitled to vote? (32739)","Richard Ottaway","I know that a strong case is being made, not least by my colleague, the Mayor of London, for this sort of change. I am very happy to look at the arguments for it, because I want to make sure that we have a fair body of union law in this country. I think the laws put in place in the 1980s are working well. We do  not currently have proposals to amend them, but I am happy to look at this argument, because I do not want to see a wave of irresponsible strikes, not least when they are not supported by a majority of people taking part.",2011-01-12,NULL
48321,"Q9.   Does not the Prime Minister’s plan to sell off the forests show once again that he knows the price of everything but the value of nothing? (39069)","Angela Smith","Let me say to the hon. Lady and to all hon. Members who I know are very interested in this subject that we are having a consultation; we are listening to people’s views. Let me make a couple of things clear. First, we will not do what happened under the last Government, which was the sale of forests with absolutely no guarantees of access.  Yes, that is exactly what they did. We also have a good opportunity to bust a few myths about this situation. The idea that all Forestry Commission forests are open to the public and do not charge is simply not true. Many forests, such as the New Forest, are not owned by the Forestry Commission and have much better access, no parking charges and very good records on habitat. While we are having this consultation, we should bust some of the myths that have been put around about this idea.",2011-02-09,NULL
48438,"Last night there was a violent double murder in Beck Row in Suffolk, which was the most serious in a series of incidents in the area. Will the Prime Minister assure me, and the residents of west Suffolk, that these crimes will be fully investigated, that their perpetrators will face justice and that everywhere in this country must be subject to the rule of law?","Matthew Hancock","I can certainly give my hon. Friend that assurance. This is a very disturbing case, and I am sure that hon. Members will all have heard about it this morning on the news. I think the police will want to do everything they can to get to the bottom of this dreadful crime and to bring the perpetrators to justice.",2011-03-16,NULL
48555,"Once again, the Prime Minister has not answered the question. We know from the Office for Fair Access that it is not going to cut the fees of the universities. The assistant director said at the weekend:“We are not a free pricing regulator: that is not our role...we wouldn’t say to an institution we would only allow a fee of ‘X’ or ‘Y’.”Will not the Prime Minister admit that on top of a broken promise not to raise tuition fees and a broken promise that £9,000 would be the exception, he is now breaking another promise on the capping of excessive fees?","Edward Miliband","The fact is that we will have to wait until July, when the access regulator— Let me make this point to the right hon. Gentleman. Degrees have not suddenly started to cost £7,000, £8,000 or £9,000. Degrees have always cost that much. The question is, who will pay for them? We say that successful graduates earning more than £21,000 a year should pay for them rather than taxpayers, many of whom do not go to university.I have to say this to the right hon. Gentleman. He made a promise: a promise that he would have a fully costed alternative to our fees programme by the end of the last year. Where is it? Another broken promise!",2011-05-04,NULL
48672,"Q1.   If he will list his official engagements for Wednesday 15 June. (59594)","Margot James","This morning I had meetings with ministerial colleagues and others, and in addition to my duties in this House, I shall have further such meetings later today.",2011-06-15,NULL
48789,"Q14.   Twelve days ago a young constituent of mine was the victim of a vicious knife attack. Last weekend another 16-year-old young man was also the victim of a knife attack. Will my right hon. Friend join me in  condemning this upsurge in gang-related violence and confirm that those who carry knives will face a custodial sentence if apprehended? (63883)","Bob Blackman","As I said to the hon. Member for Erith and Thamesmead (Teresa Pearce), it is important that we send a clear message about this. We are doing that with the new offence which carries a mandatory sentence. That is a signal to anyone who is contemplating carrying a knife, but we should be frank with ourselves in the House and in the country that purely looking at the issue from a criminal justice perspective is not the answer. We have to ask ourselves why so many young children are joining gangs, and why our families and communities are not doing more to keep them close and prevent the carrying of knives. That is something that runs right across Government and across our society as well.",2011-07-06,NULL
