id,question,author,answer,date,answer_relevance
34983,"To ask the Prime Minister if he will list his official engagements for Thursday 23 January.","Mr. Simon Coombs","I refer my hon. Friend to the reply that I gave some moments ago.",1992-01-23,NULL
35100,"To ask the Prime Minister if he will list his official engagements for Tuesday 18 February.","Mr. Skinner","This morning I had meetings with ministerial colleagues and others. In addition to my duties in the House, I shall be having further meetings later today.",1992-02-18,NULL
35217,"To ask the Prime Minister if he will list his official engagements for Tuesday 10 March.","Mr. Patchett","I refer the hon. Gentleman to the reply that I gave some moments ago.",1992-03-10,NULL
35334,"Is the Prime Minister aware of the dismay felt by a number of hon. Members and many historians at the fact that the papers relating to Rudolf Hess are still not being fully disclosed? Is he aware that it is the view of many people that there is a continuing Establishment cover-up which should now be revealed and that the undisclosed papers reveal matters relating to the non-royal status of the Duchess of Windsor?","Mr. Mackinlay","I am afraid that I cannot share the hon. Gentleman's conspiracy theory. If there has been a cover-up, it has been covered up from me as well.",1992-06-04,NULL
35451,"Is the Prime Minister aware that, whereas 90 per cent. of the housing stock in Sweden is insulated to a standard as good as or better than that required for new-build houses, the corresponding figure in Britain is only 16 per cent? Does he accept that a drive to improve insulation standards would not only reduce the demand for energy, which would be favourable for the environment, but assist people such as pensioners, the disabled and those on low incomes, and create jobs in a labour-intensive industry? Will the right hon. Gentleman consider that?","Mr. Wigley","We have examined the broad principles of what the hon. Gentleman suggests and I have some sympathy with the points that he makes. The budget of the Energy Efficiency Office has been increased substantially this year to £59 million—a 40 per cent. increase on the previous year. A further increase in the public expenditure plans—to £75 million—is already set out in those plans for the reasons given by the hon. Gentleman.",1992-06-30,NULL
35568,"To ask the Prime Minister if he will list his official engagements for Thursday 3 December.","Mr. Congdon","This morning I had meetings with ministerial colleagues and others. In addition to my duties in the House, I shall be having further meetings later today.",1992-12-03,NULL
35685,"Will the Prime Minister confirm that he is aware of the case of my constituent Stefan Kiszko, who was wrongfully imprisoned for 16 years for the murder of Lesley Molseed? An inquiry is being conducted by the Lancashire police into the investigation of the case by the West Yorkshire police. Will the right hon. Gentleman give a personal commitment that when that inquiry is completed, the full facts will be made known to Stefan Kiszko and his mother and to the relatives of Lesley Molseed so that they will at long last know why there was a miscarriage of justice?","Ms. Lynne","I am aware of that distressing case and I am grateful to the hon. Lady for giving me notice that she would raise that specific point. As she will know, the then Home Secretary acted to refer the case to the Court of Appeal as soon as he had received and considered the results of the police inquiry that he had ordered. As a result of that, Mr. Kiszko's conviction was quashed.",1993-02-02,NULL
35802,"To ask the Prime Minister if he will list his official engagements for Tuesday 23 February.","Dr. Kim Howells","This morning I presided at a meeting of the Cabinet and had meetings with ministerial colleagues and others. In addition to my duties in the House, I shall be having meetings with ministerial colleagues and others later today.",1993-02-23,NULL
35919,"To ask the Prime Minister if he will list his official engagements for Tuesday 16 March.","Mr. Faber","I refer my hon. Friend to the answer I gave some moments ago.",1993-03-16,NULL
36036,"To ask the Prime Minister if he will list his official engagements for Thursday 15 April.","Mr. Oppenheim","I refer my hon. Friend to the answer I gave some moments ago.",1993-04-15,NULL
36153,"To ask the Prime Minister if he will list his official engagements for Thursday 6 May.","Mr. Parry","I refer the hon. Member to the answer I gave some moments ago.",1993-05-06,NULL
36270,"I am grateful for the chance of hearing my right hon. Friend's comments. Does he agree that our troops in the former Yugoslavia have done an exceptionally difficult job with great skill and courage and that they have consistently carried out the policy of distributing humanitarian aid for as long as it has been possible for them to do so? Does he further agree that the person to emerge from the recent crisis with the least credibility is the right hon. Member for Yeovil (Mr. Ashdown), who demanded further troop deployments and then immediately demanded that they be pulled out—","Mr. Viggers","I must first congratulate my hon. Friend on his narrow escape and his capacity to swim. We are delighted to see him here today. He is right to say that British forces are doing an outstanding job in a dangerous situation. They are inevitably running risks as the  difficulties on the ground become more serious. I wish to ensure that those risks are kept to a minimum and I assure the House that the necessary contingency plans exist should there be a further deterioration in the situation. As my hon. Friend intimated, I believe that the policy that we have followed in Bosnia has been right and any other policy would have been reckless of the lives of British soldiers.",1993-06-15,NULL
36387,"Will the Prime Minister reflect on the fact that the Government have said to their rebels that nothing will stop them from ratifying the Maastricht treaty, but they have said to the House that adopting the social chapter would jeopardise the treaty? Both statements cannot be true; which is?","Mr. Ashdown","I think that the right hon. Gentleman has forgotten what he said about the social chapter.  I am glad that the right hon. Gentleman has not forgotten, but perhaps I can remind the House what he said:",1993-07-15,NULL
36504,"In view of this morning's press comments about the attitude of Her Majesty's Government towards possible payments from the European social fund, will my right hon. Friend take the opportunity to make the Government's position clear?","Mr. Lidington","I have seen suggestions in the press in recent weeks that sums due from the social fund would not be paid. Those reports are misguided. It is my expectation that the £300 million figure that has been mentioned in those press reports will be taken up by authorities within the calendar year.",1993-11-02,NULL
36621,"As we have been talking about wasting public money, will the Prime Minister tell us why he spent £292,000 on decorating No. 10 Downing street and improving the catering facilities? We thought that he had an outside caterer. Does he think that it is obscene that he should be spending that amount of taxpayer's money when, within yards of Downing street, thousands of people are living in cardboard boxes and in shop doorways? Is not it rather strange that a simple Brixton boy has become the Imelda Marcos of Downing street?","Mr. Banks","I seem to recall that the hon. Gentleman, as chairman of the Greater London council, used to arrive in the House of Commons in a  chauffeur-driven car, paid for by the ratepayers. I also seem to remember that that same south London boy blew ratepayers' money on a giant binge to celebrate the end of the GLC as well as on parties, fireworks and river trips. He even spent it on silver medallions for his GLC colleagues.",1993-12-14,NULL
36738,"Has my right hon. Friend had an opportunity to see the latest edition of "Teesside 2000", which gives details of some 20 separate investments totalling some £3·5 billion in the Teesside area? Is not that good news for Teesside and an adequate demonstration of how the Government's policy of Government agencies and the private sector are succeeding in regenerating the north-east, whereas the policy of state hand-outs to inefficient nationalised industries from the Opposition failed?","Mr. Bates","There is no doubt about the attractiveness of Teesside and of other parts of the United Kingdom to investment from overseas. Of course, that relates to a number of things—the general economic situation, the tax structure and the fact that investment in the country is welcome and is producing a good return for overseas investors.",1994-02-17,NULL
36855,"Is the Prime Minister aware that last year in Nottingham, 1,090 households faced repossession and that, in the same year, the city was allowed to build a grand total of only 12 houses for rent? Is there any practical advice and help that the Prime Minister is able to offer to the 99 per cent. of households caught in the terrible truth between his rhetoric and repossession, or is it yet another matter that is not of his concern?","Mr. Simpson","The hon. Gentleman will be pleased to know that, as the economy recovers and interest rates have fallen, the number of repossessions is also falling and falling quite distinctly. What of course is also necessary in providing rented accommodation is that local  authorities, notably Labour local authorities, should fill up the property that they have and not leave large numbers of voids and empties in many parts of the country.",1994-03-15,NULL
36972,"Has my right hon. Friend noticed the recent extensive and co-ordinated press attention to concerns about the Government's proposals to deal with new age travellers? Perhaps I can tell my right hon. Friend that the quiet majority in my constituency very much support the Government's plans as contained in the Criminal Justice and Public Order Bill, which will give them real protection from those unlawful activities.","Mr. Jonathan Evans","My hon. Friend is entirely right. New age travellers have been an immense nuisance, not least, of course, in the west country over recent years. The legislation proposed by my right hon. and learned Friend the Home Secretary will give the police far more powers to  deal with them. In view of the difficulty that there has been in the west country, I am surprised that we have not had more support from the Liberal Democrats on that matter.",1994-04-26,NULL
37089,"If my right hon. Friend will forgive me for changing the subject, does he agree that the unemployment figures released yesterday and the steady fall in unemployment over the past 12 months is welcome news which shows that our economic recovery is steady and sustainable? Does my right hon. Friend agree with me that it is somewhat strange that when the news is bad about unemployment no one questions the authenticity of the figures but when the news is good and people are getting  back into work some people seek bogusly to take away from that good news by questioning the authenticity of the figures?","Mr. Burns","My hon. Friend makes a telling point with great clarity. The facts speak for themselves: unemployment is down by about 100,000 over the last three months and it has been down by more than 250,000 over the last year. What has been especially encouraging is that long-term unemployment has been falling as well. What is equally striking is that, while unemployment falls across the whole of the United Kingdom, it is still rising throughout much of Europe. That shows the extent to which our economy has recovered and is continuing to grow, in sharp contrast to most European economies.",1994-05-19,NULL
37206,"To ask the Prime Minister if he will list his official engagements for Tuesday 12 July.","Mr. Burns","I refer my hon. Friend to the answer I gave some moments ago.",1994-07-12,NULL
37323,"Reverting to the subject of earlier exchanges, what would be my right hon. Friend's reaction if the Lord Chancellor were to include a known criminal among his appointments to the magistrates bench? Is it not equally unacceptable that the editor of The Guardian should sit in judgment on his fellow editors as a member of the Press Complaints Commission when, on his own evidence, he has been party to a forgery?","Sir Michael Neubert","That is a matter for the Press Complaints Commission and for the conscience of the editor of The Guardian.",1994-11-01,NULL
37440,"Returning to the subject of education, will my right hon. Friend take this opportunity to commend the good work that is being done in independent schools throughout the country? Will he also confirm again the Government's commitment to the assisted places scheme which has done so much for children from less well-off families? Is not it surprising that the new modern Labour party should once again attack freedom of choice in education and, indeed, make it more difficult for its leader to exercise choice for his own family?","Mr. Thompson","It is entirely apt that my hon. Friend should ask that question when the hon. Member for Sheffield, Hillsborough (Mrs. Jackson) has just been talking about people at the bottom of the income scale. The assisted places scheme is a way to help people at the bottom of the income scale and the hon. Lady opposes it, as do her right hon. and hon. Friends. Parental choice is a fundamental principle of our policy. We choose to exercise it for everyone, not just for some, and I fail to understand how members of the Labour party, which claims to pride itself on equality of opportunity, would deny the opportunities under the assisted places scheme to some of the poorest children in Britain. What it shows yet again is the gap between what they say and what they practise.",1994-12-08,NULL
37557,"Will my right hon. Friend reaffirm the Government's support for British agriculture in order to assert that farmers are as entitled as any other of Her Majesty's subjects to earn their living under the law, and that includes selling their young veal calves at a proper market price if they so choose? Will he confirm that causing mayhem at British ports and airports is no way to stop practices in other countries that we have banned here, and that those who do so should take their cause to other countries in the Community and to the European Parliament, not pursue it here?","Mr. William Powell","My hon. Friend is right to stress the importance of the farming industry and entirely right to stress the fact that farmers have a right to carry on their trade within the law, as does everyone else. I think that my hon. Friend and the House know our opposition to veal crates and of the measures taken by my right hon. Friend the Minister of Agriculture,  Fisheries and Food to try to ensure that they are taken out of commission not just in the United Kingdom but right across Europe.",1995-02-07,NULL
37674,"To ask the Prime Minister if he will list his official engagements for Thursday 2 March.","Mr. Etherington","I refer the hon. Member to the reply that I gave some moments ago.",1995-03-02,NULL
37791,"Will my right hon. Friend congratulate Maldon district council, which yesterday received nearly £22 million following the transfer of its housing stock to the Plume housing association? Is he aware that that will enable the council to improve services and to continue to set the lowest council tax in Essex? Does that not demonstrate once again that Conservative councils deliver better services at a lower cost to the council tax payer?","Mr. Whittingdale","My hon. Friend refers to Maldon, but he could equally well have referred to a very large number of Conservative authorities, which, on balance, provide a council tax that is far lower than that of authorities run by the Labour or Liberal parties. Equally,  I congratulate Maldon on taking advantage of the policies to bring in private finance and to provide better services generally to its council tax payers. I believe that runs right the way across the gamut of local authority services. For those people who talk about the homeless, I note the very large number of empty properties in Labour-controlled authorities in inner London and in the middle of many of our great cities.",1995-03-28,NULL
37908,"Since so many charities have lost income because of the national lottery and since Lady Churchill so freely gave to the national archives so many of Sir Winston's works, does the Prime Minister not think that it would be patriotic to follow her example today?","Mr. Griffiths","Charities will find that they will be substantial beneficiaries of the national lottery—that will continue to happen year after year. I should have thought that the hon. Gentleman would have welcomed the substantial help that will go, not only to charities, but to a number of other worthy causes, as a result of the Government's initiative.",1995-04-27,NULL
38025,"From the Government's overwhelming defeat in the local elections last month, it is clear that the electorate totally rejected their local government policies. In particular, people rejected the Government notion that Labour authorities are high taxing and high spending. Will the Government now abandon plans to cap the expenditure of local authorities this year?","Mr. Illsley","I have very great doubts about whether people have abandoned the notion that Labour means high taxes, both nationally and locally. If one looks band for band at local taxation last year, one finds that in band C, for example—I take the figures from memory, but I think that they are right—Labour councils taxed about £160 more than Conservative councils. That point will be understood increasingly as people examine their tax bills.",1995-05-25,NULL
38142,"Instead of watching it, why does the Prime Minister not act to put a stop to the abuses now?","Mr. Blair","The right hon. Gentleman knows, for I have told him before—he is clearly a slow learner on this point—that we will wait and see what the committee examining the matter reports. When we have the facts in front of us, we will be in a position to take a decision: I prefer facts before decisions.",1995-07-04,NULL
38259,"To ask the Prime Minister if he will list his official engagements for Tuesday 5 December. ","Ms Corston","I refer the hon. Member to the answer I gave some moments ago.",1995-12-05,NULL
38376,"Has the Prime Minister seen the figures produced by the Royal College of Nursing, which show that the number of nurses qualifying each year has fallen from some 37,000 in 1983 to only 13,000 last year? The resulting staff shortages have caused a crisis in our accident and emergency and intensive care units. Do not those figures confirm that the NHS is no longer safe in Tory hands, and never was, or is the Royal College of Nursing distorting the figures?","Mr. Ainger","I will just give the hon. Gentleman the figures. There are 22,000 more doctors than there were in 1979, and 34,000 more qualified nurses. It is not the Conservative party or the Government who have cut back on the health service. The only time that that has occurred was when the hon. Gentleman's party was in office. He should recall that and bear in mind that the Conservatives have delivered increased investment to the national health service, which means better service, more front-line care, which is better and earlier, and a wider range of care.",1996-01-18,NULL
38493,"Does my right hon. Friend share the following view expressed in today's The Times:","Mr. Brooke","Yes, I agree with the comment. That economic scenario has resulted from the sustained policies that the Government have followed for some time. We now have the lowest sustained level of inflation for 50 years, which today has fallen to below 3 per cent; the lowest mortgage rates for 30 years; the lowest basic rate of tax for 50 years; more foreign investment than any other nation in Europe; and we export more per person than Japan and the United States.",1996-02-15,NULL
38610,"To ask the Prime Minister when he expects to pay a visit to the Easington constituency. ","Mr. Cummings","I have at present no plans to do so.",1996-03-19,NULL
38727,"Does my right hon. Friend share the universal disgust that, despite the clear way forward that has been mapped out for enduring peace and stability in Northern Ireland, the IRA's bombing campaign continues unabated? Does he share my outrage that a proposal to condemn the ending of the IRA ceasefire was rejected by the Labour party in Islington?","Mr. Spring","I can only hope that the Leader of the Opposition will bring his own party in Islington into line on a matter of importance to everyone in the United Kingdom. It puts into proper context the nonsense that the right hon. Gentleman has just been talking to the House.",1996-04-25,NULL
38844,"Will my right hon. Friend welcome the recent fall in unemployment, which is a sign of good economic management? Will he join me in congratulating Layeezee Beds in Batley, which recently recruited 60 new members to its work force because of demand for that company's products?","Mrs. Peacock","I am delighted to hear that good news from my hon. Friend's constituency, which is reflected in many constituencies throughout the country. The economy is in better condition than at any time for a generation, which is why we were able to reduce interest rates yet again last week—simply because we have been successful in keeping inflation under control. Our policies are working, inflation is falling, unemployment is falling, growth is beginning to accelerate and this country has better economic circumstances than for many years past—and they are better than in many of our competitor countries on the continent.",1996-06-11,NULL
38961,"In the light of the great news that Lite-On and LG are bringing thousands of new jobs to Scotland and Wales, does my right hon. Friend agree that breaking up the United Kingdom, creating an extra tier of regional government, surrounding it all in bureaucracy and making the Scots pay more tax is likely to scare away potential new investors? Is this not new Labour being new danger?","Mrs. Lait","I am delighted to welcome these substantial new investments to Scotland and Wales. They are the latest of a large number of inward investments that we have seen not only in Scotland and Wales but in other parts of the United Kingdom. I certainly hope that we shall get more. They are coming here predominantly because of the economic environment——because this country is an economic success story— The hon. Member for Carrick, Cumnock and Doon Valley (Mr. Foulkes) is chuntering in the back row. He seems to forget that they have been coming here for 15 years under Conservative policies, because we have created a combination of lower inflation, lower taxes and lower costs. That is attractive not just to companies in this country but to world investors seeking the right country in which to place their money. I am delighted that they place it here. It would be a tragedy if policies were followed that would prevent them from doing so in future.",1996-07-16,NULL
39078,"Perhaps the Prime Minister can tell us of a successful company in Britain that does not give its work force a holiday. If the directive is so dreadful, why did the Minister not vote against it when he had the chance to do so? May we be clear about the Government's position at the intergovernmental conference? Will the Prime Minister confirm that his position is this: all member states must agree at the outset of the conference that no progress will be made on any change proposed by any country in respect of any issue until the directive is reversed? Is that his position? If the directive is so dreadful, why did the Minister not vote against it when he had the chance to do so? May we be clear about the Government's position at the intergovernmental conference? Will the Prime Minister confirm that his position is this: all member states must agree at the outset of the conference that no progress will be made on any change proposed by any country in respect of any issue until the directive is reversed? Is that his position?","Mr. Blair","If the right hon. Gentleman's first point was correct, why do we need the directive? He made precisely the Government's point. Such directives pile burdens on business and they are bound to undermine our economic success. Their damage to the fruits of our economic success will affect the extra resources that we  are providing to the health service, as my right hon. Friend the Secretary of State for Health will set out in a White Paper tomorrow. They will damage the provision of opportunity for all four-year-olds to have nursery education, as my right hon. Friend the Secretary of State for Education and Employment will set out tomorrow. I am not prepared to allow the product of years of good, sound economic management to be undermined by regulation from Brussels. I shall tell the right hon. Gentleman precisely what the position is at the intergovernmental conference: it is exactly the same as it was on the social chapter at Maastricht. I shall not accept what has been determined by the court today and, at the end of the intergovernmental conference, I shall demand that change or there will be no end to the intergovernmental conference.",1996-11-12,NULL
